{
  "report_id": "audit-evidence-session-01",
  "generated_at": "2026-03-14T13:10:00Z",
  "workspace": "/workspace/aios",
  "json_report": "/workspace/out/validation/audit-evidence-report.json",
  "markdown_report": "/workspace/out/validation/audit-evidence-report.md",
  "session": {
    "session_id": "session-01",
    "user_id": "user-01",
    "status": "active",
    "created_at": "2026-03-14T13:00:00Z",
    "last_resumed_at": "2026-03-14T13:05:00Z",
    "metadata": {
      "initial_intent": "Delete a temporary file after approval"
    }
  },
  "inputs": {
    "session_db": "/workspace/state/sessiond/sessiond.sqlite3",
    "policy_audit_log": "/workspace/state/policyd/audit.jsonl",
    "audit_index": "/workspace/state/policyd/audit-index.json",
    "runtime_events_log": "/workspace/state/runtimed/runtime-events.jsonl",
    "remote_audit_log": "/workspace/state/runtimed/remote-audit.jsonl",
    "observability_log": "/workspace/state/runtimed/observability.jsonl",
    "domain_config": "/workspace/out/validation/audit-evidence-domain-config.json"
  },
  "audit_store": {
    "active_segment_path": "/workspace/state/policyd/audit.jsonl",
    "active_record_count": 4,
    "archived_segment_count": 1,
    "archived_segments": [
      {
        "path": "/workspace/state/policyd/audit-archive/audit-20260314-120000.jsonl",
        "record_count": 8,
        "first_timestamp": "2026-03-14T12:00:00Z",
        "last_timestamp": "2026-03-14T12:45:00Z"
      }
    ]
  },
  "summary": {
    "task_count": 2,
    "audit_entry_count": 4,
    "runtime_event_count": 3,
    "remote_audit_count": 0,
    "observability_record_count": 6,
    "approval_ref_count": 3,
    "approval_scope_count": 2,
    "target_bound_approval_count": 1,
    "constraint_bound_approval_count": 1,
    "approval_scope_mismatch_count": 0,
    "archived_segment_count": 1,
    "domain_count": 7,
    "covered_domains": [
      "compat",
      "control-plane",
      "device",
      "hardware",
      "provider",
      "shell",
      "updated"
    ],
    "audit_decisions": [
      "allowed",
      "approval-approved",
      "approval-pending",
      "denied",
      "token-issued",
      "token-valid"
    ],
    "runtime_event_kinds": [
      "runtime.infer.started",
      "runtime.infer.completed"
    ],
    "observability_kinds": [
      "task.state.updated",
      "runtime.infer.completed"
    ],
    "artifact_paths": [
      "/workspace/out/validation/audit-evidence-domain-config.json",
      "/workspace/out/validation/system-delivery-validation-evidence-index.json",
      "/workspace/out/validation/system-delivery-validation-report.json",
      "/workspace/out/validation/tier1-hardware-boot-evidence-report.json",
      "/workspace/out/validation/tier1-hardware-evidence-index.json",
      "/workspace/state/compat/browser-audit.jsonl",
      "/workspace/state/compat/office-audit.jsonl",
      "/workspace/state/device/backend-state.json",
      "/workspace/state/device/captures.json",
      "/workspace/state/device/observability.jsonl",
      "/workspace/state/policyd/audit-index.json",
      "/workspace/state/policyd/audit.jsonl",
      "/workspace/state/provider/runtime-provider-observability.jsonl",
      "/workspace/state/runtimed/observability.jsonl",
      "/workspace/state/runtimed/runtime-events.jsonl",
      "/workspace/state/sessiond/sessiond.sqlite3",
      "/workspace/state/shell/focus-state.json",
      "/workspace/state/shell/panel-action-events.jsonl",
      "/workspace/state/updated/boot-control.json",
      "/workspace/state/updated/deployment-state.json",
      "/workspace/state/updated/diagnostics/diag-001.json",
      "/workspace/state/updated/health-probe.json",
      "/workspace/state/updated/observability.jsonl",
      "/workspace/state/updated/recovery-surface.json",
      "/workspace/state/updated/recovery/recovery-001.json"
    ]
  },
  "domain_evidence": {
    "control-plane": {
      "domain": "control-plane",
      "source_count": 5,
      "record_count": 14,
      "task_count": 2,
      "artifact_paths": [
        "/workspace/out/validation/audit-evidence-domain-config.json",
        "/workspace/state/policyd/audit-index.json",
        "/workspace/state/policyd/audit.jsonl",
        "/workspace/state/runtimed/observability.jsonl",
        "/workspace/state/runtimed/runtime-events.jsonl",
        "/workspace/state/sessiond/sessiond.sqlite3"
      ],
      "audit_decisions": [
        "allowed",
        "approval-approved",
        "approval-pending",
        "token-issued"
      ],
      "event_kinds": [
        "runtime.infer.completed",
        "runtime.infer.started",
        "task.state.updated"
      ],
      "status_values": [],
      "provider_ids": [],
      "approval_refs": [
        "apr-01"
      ],
      "capability_ids": [
        "fs.delete",
        "runtime.infer.submit"
      ],
      "action_ids": [],
      "sources": [
        {
          "kind": "audit_log",
          "format": "jsonl",
          "path": "/workspace/state/policyd/audit.jsonl",
          "present": true,
          "record_count": 4
        },
        {
          "kind": "runtime_events_log",
          "format": "jsonl",
          "path": "/workspace/state/runtimed/runtime-events.jsonl",
          "present": true,
          "record_count": 3
        },
        {
          "kind": "remote_audit_log",
          "format": "jsonl",
          "path": "/workspace/state/runtimed/remote-audit.jsonl",
          "present": true,
          "record_count": 0
        },
        {
          "kind": "observability_log",
          "format": "jsonl",
          "path": "/workspace/state/runtimed/observability.jsonl",
          "present": true,
          "record_count": 6
        },
        {
          "kind": "audit_index",
          "format": "json",
          "path": "/workspace/state/policyd/audit-index.json",
          "present": true,
          "record_count": 1
        }
      ],
      "notes": []
    },
    "shell": {
      "domain": "shell",
      "source_count": 3,
      "record_count": 7,
      "artifact_paths": [
        "/workspace/state/policyd/audit.jsonl",
        "/workspace/state/shell/focus-state.json",
        "/workspace/state/shell/panel-action-events.jsonl"
      ],
      "audit_decisions": [
        "token-issued",
        "token-valid"
      ],
      "event_kinds": [
        "panel-action.dispatch"
      ],
      "status_values": [
        "dispatch-failed(approve)",
        "dispatch-ok(refresh)"
      ],
      "provider_ids": [],
      "approval_refs": [],
      "capability_ids": [
        "shell.notification.open",
        "shell.panel-events.list",
        "shell.window.focus"
      ],
      "action_ids": [
        "approve",
        "refresh"
      ],
      "sources": [
        {
          "kind": "audit_log",
          "format": "jsonl",
          "path": "/workspace/state/policyd/audit.jsonl",
          "present": true,
          "record_count": 5
        },
        {
          "kind": "panel_actions",
          "format": "jsonl",
          "path": "/workspace/state/shell/panel-action-events.jsonl",
          "present": true,
          "record_count": 2
        },
        {
          "kind": "focus_state",
          "format": "json",
          "path": "/workspace/state/shell/focus-state.json",
          "present": true,
          "record_count": 1
        }
      ],
      "notes": []
    },
    "provider": {
      "domain": "provider",
      "source_count": 4,
      "record_count": 18,
      "artifact_paths": [
        "/workspace/state/policyd/audit.jsonl",
        "/workspace/state/provider/provider-health.json",
        "/workspace/state/provider/runtime-provider-observability.jsonl",
        "/workspace/state/provider/runtimed-observability.jsonl"
      ],
      "audit_decisions": [
        "token-issued",
        "token-valid"
      ],
      "event_kinds": [
        "provider.registry.registered",
        "provider.runtime.started",
        "runtime.infer.completed",
        "runtime.infer.started"
      ],
      "status_values": [
        "available",
        "ready"
      ],
      "provider_ids": [
        "runtime.local.inference"
      ],
      "approval_refs": [],
      "capability_ids": [
        "runtime.embed.vectorize",
        "runtime.infer.submit",
        "runtime.rerank.score"
      ],
      "action_ids": [],
      "sources": [
        {
          "kind": "audit_log",
          "format": "jsonl",
          "path": "/workspace/state/policyd/audit.jsonl",
          "present": true,
          "record_count": 8
        },
        {
          "kind": "provider_observability",
          "format": "jsonl",
          "path": "/workspace/state/provider/runtime-provider-observability.jsonl",
          "present": true,
          "record_count": 6
        },
        {
          "kind": "runtime_observability",
          "format": "jsonl",
          "path": "/workspace/state/provider/runtimed-observability.jsonl",
          "present": true,
          "record_count": 4
        },
        {
          "kind": "provider_health",
          "format": "json",
          "path": "/workspace/state/provider/provider-health.json",
          "present": true,
          "record_count": 1
        }
      ],
      "notes": [
        "synthetic provider baseline retained for operator-facing evidence export"
      ]
    },
    "compat": {
      "domain": "compat",
      "source_count": 5,
      "record_count": 14,
      "artifact_paths": [
        "/workspace/state/compat/compat-browser-automation-local.jsonl",
        "/workspace/state/compat/compat-code-sandbox-local.jsonl",
        "/workspace/state/compat/compat-mcp-bridge-local.jsonl",
        "/workspace/state/compat/compat-office-document-local.jsonl",
        "/workspace/state/compat/compat-observability.jsonl"
      ],
      "audit_decisions": [
        "allowed",
        "denied"
      ],
      "event_kinds": [],
      "status_values": [
        "error",
        "not-found",
        "ok",